{
  "schema": "voice-ui.component-axes-input/1",
  "axis": "E",
  "oracle_sha256": "f2a4265a75e15b051610eb1ae8796a9cdb0e26c4d96331f12150d709e4acd854",
  "fixture_contract": {
    "map_id": "voice-graph",
    "base_records": [
      {
        "type": "meta",
        "schema": "semantic-map-state/1",
        "root": "root",
        "title": "independent component axes"
      },
      {
        "type": "region",
        "id": "root",
        "parent": null,
        "label": "fixture",
        "kind": "boundary",
        "bounds": [
          0,
          0,
          900,
          400
        ],
        "summary": ""
      },
      {
        "type": "region",
        "id": "container",
        "parent": "root",
        "label": "OCI",
        "kind": "group",
        "bounds": [
          0,
          0,
          700,
          200
        ],
        "summary": ""
      },
      {
        "type": "region",
        "id": "other",
        "parent": "root",
        "label": "Other",
        "kind": "group",
        "bounds": [
          0,
          230,
          700,
          160
        ],
        "summary": ""
      }
    ],
    "base_pins": [
      {
        "regionId": "container",
        "bounds": [
          0,
          0,
          2000,
          500
        ]
      },
      {
        "regionId": "other",
        "bounds": [
          0,
          600,
          2000,
          500
        ]
      }
    ],
    "fixtures": {
      "empty": {
        "extra_records": [],
        "extra_pins": []
      },
      "api": {
        "extra_records": [
          {
            "type": "region",
            "id": "initial-api",
            "parent": "container",
            "label": "API",
            "kind": "step",
            "bounds": [
              20,
              20,
              140,
              64
            ],
            "summary": ""
          }
        ],
        "extra_pins": [
          {
            "regionId": "initial-api",
            "bounds": [
              12,
              36,
              140,
              64
            ]
          }
        ]
      },
      "pair": {
        "extra_records": [
          {
            "type": "region",
            "id": "initial-api",
            "parent": "container",
            "label": "API",
            "kind": "step",
            "bounds": [
              20,
              20,
              140,
              64
            ],
            "summary": ""
          },
          {
            "type": "region",
            "id": "initial-db",
            "parent": "container",
            "label": "DB",
            "kind": "data",
            "bounds": [
              200,
              20,
              140,
              64
            ],
            "summary": ""
          }
        ],
        "extra_pins": [
          {
            "regionId": "initial-api",
            "bounds": [
              12,
              36,
              140,
              64
            ]
          },
          {
            "regionId": "initial-db",
            "bounds": [
              200,
              36,
              140,
              64
            ]
          }
        ]
      }
    },
    "recent_conversation": [],
    "scope": null
  },
  "cases": [
    {
      "id": "H01",
      "fixture": "empty",
      "utterance": "OCIの中にAPIをひとつ追加して。ほかは変えないで。"
    },
    {
      "id": "H05",
      "fixture": "empty",
      "utterance": "OCIの中に「整形受付」という名前の工程をひとつだけ作って。"
    },
    {
      "id": "H07",
      "fixture": "empty",
      "utterance": "OCIにDBを3つ追加して。表示名は3つともDBで、矢印はいらない。"
    },
    {
      "id": "N09",
      "fixture": "empty",
      "utterance": "OCIの中へ何かを一つ追加して。名前と図形の種類はまだ決めていません。"
    }
  ]
}
